{
  "status": "passed",
  "hardFailures": [],
  "warnings": [
    "model has no Arena score: mv_mistral__codestral-2508",
    "model has no Arena score: mv_cohere__command-a-plus-05-2026",
    "model has no Arena score: mv_sakana__fugu-max",
    "model has no Arena score: mv_zhipuai__glm-4.7-flashx",
    "model has no Arena score: mv_inception__mercury-3",
    "model has no Arena score: mv_alibaba__qwen3.8-flash",
    "model has no Arena score: mv_alibaba__qwen3.8-omni-flash",
    "model has no Arena score: mv_bytedance-seed__seed-2.1-pro",
    "model has no Arena score: mv_bytedance-seed__seed-character",
    "model has no Arena score: mv_bytedance-seed__seed-evolving"
  ],
  "stats": {
    "launchModels": 43,
    "models": 43,
    "offers": 1268,
    "scores": 61,
    "unmatched": 507,
    "modelsWithScores": 33,
    "modelsWithoutScores": 10,
    "byBoard": {
      "text": 30,
      "webdev": 31
    },
    "offerStatusCounts": {
      "available_unmarked": 1243,
      "beta": 18,
      "deprecated": 7
    },
    "offerKindCounts": {
      "cloud": 110,
      "first_party": 59,
      "gateway": 1099
    },
    "availabilityCounts": {
      "available": 39,
      "mixed": 4
    },
    "fxAgeDays": 1,
    "arena": {
      "textRows": 11132,
      "webdevRows": 655,
      "textCategoryRows": 419,
      "webdevCategoryRows": 152,
      "textDeduped": 419,
      "webdevDeduped": 151,
      "scores": 61,
      "unmatched": 507,
      "matchedRows": 61,
      "byBoard": {
        "text": 30,
        "webdev": 31
      }
    },
    "overrides": {
      "count": 0,
      "applied": 0,
      "hash": "c66340a9362f142d6b60fc5bf60607c7c5e61c5dfe5b82bcb0e3246b723fdd85"
    }
  },
  "generatedAt": "2026-10-31T09:51:49.701Z",
  "snapshotId": "20261031-746354f0"
}
